{
  "external_ref": "0b7c6a2e-5d1f-4c1a-9a7e-2f4e9c1d8a01",
  "version": "7",
  "sensitivity": "public",
  "registration_number": "R-2026-000123",
  "received_at": "2026-10-27T13:58:41Z",
  "direction": "incoming",
  "subject": "Solicitud de copia del contrato de obra 045 de 2026",
  "document_type": null,
  "unit": "U-210",
  "due_date": null,
  "status": "received",
  "channel": "email",
  "closed": false,
  "parties": [
    {
      "role": "sender",
      "name": "Ana María Rojas",
      "organization": null,
      "host_party_ref": null,
      "identifiers": [
        {
          "scheme": "national_id",
          "value": "52123456"
        }
      ]
    }
  ],
  "links": [],
  "extra": {
    "intake_note": "Recibido por correo institucional"
  }
}
